{
  "$schema": "https://json-schema.org/draft/2020-12/schema",
  "type": "object",
  "properties": {
    "id": {
      "type": "string"
    },
    "contentId": {
      "type": "string"
    },
    "translationKey": {
      "type": "string"
    },
    "slug": {
      "type": "object",
      "properties": {
        "es": {
          "type": "string"
        },
        "en": {
          "type": "string"
        },
        "de": {
          "type": "string"
        }
      },
      "required": [
        "es",
        "en",
        "de"
      ]
    },
    "title": {
      "type": "object",
      "properties": {
        "es": {
          "type": "string"
        },
        "en": {
          "type": "string"
        },
        "de": {
          "type": "string"
        }
      },
      "required": [
        "es",
        "en",
        "de"
      ]
    },
    "description": {
      "type": "object",
      "properties": {
        "es": {
          "type": "string"
        },
        "en": {
          "type": "string"
        },
        "de": {
          "type": "string"
        }
      },
      "required": [
        "es",
        "en",
        "de"
      ]
    },
    "taxonomyIds": {
      "type": "array",
      "items": {
        "type": "string"
      }
    },
    "time": {
      "type": "number"
    },
    "image": {
      "type": "string"
    },
    "prepTimeMinutes": {
      "type": "number"
    },
    "cookTimeMinutes": {
      "type": "number"
    },
    "yieldServings": {
      "type": "number"
    },
    "ingredients": {
      "type": "array",
      "items": {
        "type": "object",
        "properties": {
          "id": {
            "type": "string"
          },
          "ingredientId": {
            "type": "string"
          },
          "name": {
            "type": "object",
            "properties": {
              "es": {
                "type": "string"
              },
              "en": {
                "type": "string"
              },
              "de": {
                "type": "string"
              }
            },
            "required": [
              "es",
              "en",
              "de"
            ]
          },
          "amount": {
            "type": "number"
          },
          "unit": {
            "type": "string",
            "enum": [
              "g",
              "ml",
              "unit"
            ]
          },
          "notes": {
            "type": "object",
            "properties": {
              "es": {
                "type": "string"
              },
              "en": {
                "type": "string"
              },
              "de": {
                "type": "string"
              }
            },
            "required": [
              "es",
              "en",
              "de"
            ]
          }
        },
        "required": [
          "id",
          "ingredientId",
          "name",
          "amount",
          "unit"
        ]
      }
    },
    "instructions": {
      "type": "array",
      "items": {
        "type": "object",
        "properties": {
          "step": {
            "type": "object",
            "properties": {
              "es": {
                "type": "string"
              },
              "en": {
                "type": "string"
              },
              "de": {
                "type": "string"
              }
            },
            "required": [
              "es",
              "en",
              "de"
            ]
          },
          "text": {
            "type": "object",
            "properties": {
              "es": {
                "type": "string"
              },
              "en": {
                "type": "string"
              },
              "de": {
                "type": "string"
              }
            },
            "required": [
              "es",
              "en",
              "de"
            ]
          }
        },
        "required": [
          "step",
          "text"
        ]
      }
    },
    "sources": {
      "type": "array",
      "items": {
        "type": "object",
        "properties": {
          "type": {
            "type": "string",
            "enum": [
              "chef",
              "restaurant",
              "book",
              "website",
              "traditional",
              "community",
              "user"
            ]
          },
          "name": {
            "type": "string"
          },
          "author": {
            "type": "string"
          },
          "url": {
            "type": "string"
          },
          "description": {
            "type": "object",
            "properties": {
              "es": {
                "type": "string"
              },
              "en": {
                "type": "string"
              },
              "de": {
                "type": "string"
              }
            },
            "required": [
              "es",
              "en",
              "de"
            ]
          }
        },
        "required": [
          "type",
          "name"
        ]
      }
    },
    "author": {
      "type": "object",
      "properties": {
        "type": {
          "type": "string",
          "enum": [
            "platform",
            "user"
          ]
        },
        "userId": {
          "type": "string"
        },
        "name": {
          "type": "string"
        }
      },
      "required": [
        "type",
        "name"
      ]
    },
    "$schema": {
      "type": "string"
    }
  },
  "required": [
    "id",
    "slug",
    "title",
    "description",
    "taxonomyIds",
    "time"
  ]
}