{
  "id": "betanzos",
  "contentId": "recipe.betanzos",
  "translationKey": "recipe-betanzos",
  "slug": {
    "es": "tortilla-betanzos",
    "en": "betanzos-style-spanish-omelette",
    "de": "betanzos-tortilla"
  },
  "title": {
    "es": "Tortilla de Betanzos Jugosa",
    "en": "Runny Betanzos-Style Spanish Omelette",
    "de": "Saftige Betanzos-Tortilla"
  },
  "description": {
    "es": "La icónica tortilla gallega de Betanzos: muy jugosa, con abundante huevo, patata tierna y un interior casi líquido.",
    "en": "The iconic Galician Betanzos tortilla: egg-forward, with tender potatoes and an almost liquid creamy center.",
    "de": "Die ikonische galicische Betanzos-Tortilla: ei-betont, mit zarten Kartoffeln und fast flüssigem cremigem Kern."
  },
  "taxonomyIds": [
    "faction:puristas",
    "ingredient:potato",
    "ingredient:egg",
    "ingredient:egg_yolk",
    "ingredient:oil",
    "ingredient:salt",
    "region:betanzos",
    "style:juicy",
    "technique:short_cook",
    "technique:frying",
    "difficulty:medium"
  ],
  "time": 25,
  "prepTimeMinutes": 10,
  "cookTimeMinutes": 15,
  "yieldServings": 4,
  "image": "/images/recipes/betanzos.svg",
  "ingredients": [
    {
      "id": "potato",
      "ingredientId": "potato",
      "name": {
        "es": "Patata",
        "en": "Potato",
        "de": "Kartoffel"
      },
      "amount": 500,
      "unit": "g",
      "notes": {
        "es": "Patata cortada fina y cocinada hasta quedar muy tierna",
        "en": "Thinly sliced potatoes cooked until very tender",
        "de": "Dünn geschnittene Kartoffeln, sehr weich gegart"
      }
    },
    {
      "id": "egg",
      "ingredientId": "egg",
      "name": {
        "es": "Huevo",
        "en": "Egg",
        "de": "Ei"
      },
      "amount": 8,
      "unit": "unit",
      "notes": {
        "es": "8 huevos camperos",
        "en": "8 free-range eggs",
        "de": "8 Freilandeier"
      }
    },
    {
      "id": "egg_yolk",
      "ingredientId": "egg_yolk",
      "name": {
        "es": "Yema extra",
        "en": "Extra egg yolks",
        "de": "Zusätzliche Eigelb"
      },
      "amount": 2,
      "unit": "unit",
      "notes": {
        "es": "Yemas añadidas para aumentar cremosidad y untuosidad",
        "en": "Extra yolks added for richness and creaminess",
        "de": "Zusätzliche Eigelb für mehr Cremigkeit"
      }
    },
    {
      "id": "oil",
      "ingredientId": "oil",
      "name": {
        "es": "Aceite de Oliva Virgen Extra",
        "en": "Extra Virgin Olive Oil",
        "de": "Natives Olivenöl Extra"
      },
      "amount": 150,
      "unit": "ml",
      "notes": {
        "es": "Aceite abundante para freír la patata",
        "en": "Generous olive oil for frying potatoes",
        "de": "Reichlich Olivenöl zum Braten der Kartoffeln"
      }
    },
    {
      "id": "salt",
      "ingredientId": "salt",
      "name": {
        "es": "Sal",
        "en": "Salt",
        "de": "Salz"
      },
      "amount": 7,
      "unit": "g",
      "notes": {
        "es": "Sal al gusto",
        "en": "Salt to taste",
        "de": "Salz nach Geschmack"
      }
    }
  ],
  "instructions": [
    {
      "step": {
        "es": "Preparar las patatas",
        "en": "Prepare the potatoes",
        "de": "Kartoffeln vorbereiten"
      },
      "text": {
        "es": "Pelar las patatas y cortarlas en láminas muy finas e irregulares.",
        "en": "Peel the potatoes and cut them into very thin irregular slices.",
        "de": "Kartoffeln schälen und in sehr dünne unregelmäßige Scheiben schneiden."
      }
    },
    {
      "step": {
        "es": "Confitar las patatas",
        "en": "Slow-fry the potatoes",
        "de": "Kartoffeln confieren"
      },
      "text": {
        "es": "Cocinar las patatas en abundante aceite de oliva a fuego medio hasta que estén tiernas pero no demasiado doradas.",
        "en": "Cook the potatoes in plenty of olive oil over medium heat until tender but not heavily browned.",
        "de": "Kartoffeln in reichlich Olivenöl bei mittlerer Hitze weich garen."
      }
    },
    {
      "step": {
        "es": "Mezclar con huevo",
        "en": "Combine with eggs",
        "de": "Mit Ei vermischen"
      },
      "text": {
        "es": "Batir los huevos con sal y añadir las patatas calientes. Dejar que absorban parte del huevo.",
        "en": "Beat the eggs with salt and add the hot potatoes. Allow them to absorb some of the egg.",
        "de": "Eier mit Salz schlagen und die heißen Kartoffeln hinzufügen."
      }
    },
    {
      "step": {
        "es": "Reposar la mezcla",
        "en": "Rest the mixture",
        "de": "Mischung ruhen lassen"
      },
      "text": {
        "es": "Dejar reposar unos minutos para conseguir una textura más cremosa.",
        "en": "Rest for a few minutes to achieve a creamier texture.",
        "de": "Einige Minuten ruhen lassen, damit eine cremigere Textur entsteht."
      }
    },
    {
      "step": {
        "es": "Cuajar la tortilla",
        "en": "Cook the omelette",
        "de": "Tortilla braten"
      },
      "text": {
        "es": "Cuajar en sartén muy caliente durante pocos segundos por cada lado. El centro debe quedar líquido y cremoso.",
        "en": "Cook in a very hot pan for a few seconds on each side. The center should remain runny and creamy.",
        "de": "In einer sehr heißen Pfanne wenige Sekunden pro Seite braten. Die Mitte bleibt flüssig und cremig."
      }
    }
  ],
  "sources": [
    {
      "type": "traditional",
      "name": "Betanzos tortilla tradition",
      "description": {
        "es": "Estilo gallego caracterizado por un interior muy poco cuajado.",
        "en": "Galician style known for a very runny centre.",
        "de": "Galicischer Stil mit sehr flüssigem Kern."
      }
    }
  ],
  "author": {
    "type": "platform",
    "name": "tortilladepatatas.org"
  }
}