{
  "id": "clasica",
  "contentId": "recipe.classic",
  "translationKey": "recipe-clasica",
  "slug": {
    "es": "tortilla-clasica",
    "en": "classic-spanish-omelette",
    "de": "klassische-spanische-tortilla"
  },
  "title": {
    "es": "Tortilla Clásica sin Cebolla",
    "en": "Classic Spanish Omelette Without Onion",
    "de": "Klassische Spanische Tortilla ohne Zwiebel"
  },
  "description": {
    "es": "La receta fundamental de la tortilla española: patata, huevo, aceite y sal. El equilibrio perfecto entre tradición y técnica.",
    "en": "The fundamental Spanish omelette recipe: potato, egg, olive oil, and salt. The perfect balance between tradition and technique.",
    "de": "Das Grundrezept der spanischen Tortilla: Kartoffeln, Ei, Olivenöl und Salz. Perfekte Balance zwischen Tradition und Technik."
  },
  "taxonomyIds": [
    "faction:puristas",
    "faction:ajistas",
    "ingredient:potato",
    "ingredient:egg",
    "ingredient:oil",
    "ingredient:salt",
    "technique:confit",
    "difficulty:easy"
  ],
  "time": 40,
  "prepTimeMinutes": 15,
  "cookTimeMinutes": 25,
  "yieldServings": 4,
  "image": "/images/recipes/clasica.svg",
  "ingredients": [
    {
      "id": "potato",
      "ingredientId": "potato",
      "name": {
        "es": "Patata",
        "en": "Potato",
        "de": "Kartoffel"
      },
      "amount": 600,
      "unit": "g",
      "notes": {
        "es": "5 patatas medianas",
        "en": "5 medium potatoes",
        "de": "5 mittelgroße Kartoffeln"
      }
    },
    {
      "id": "egg",
      "ingredientId": "egg",
      "name": {
        "es": "Huevo",
        "en": "Egg",
        "de": "Ei"
      },
      "amount": 6,
      "unit": "unit",
      "notes": {
        "es": "6 huevos",
        "en": "6 eggs",
        "de": "6 Eier"
      }
    },
    {
      "id": "oil",
      "ingredientId": "oil",
      "name": {
        "es": "Aceite de Oliva Virgen Extra",
        "en": "Extra Virgin Olive Oil",
        "de": "Natives Olivenöl Extra"
      },
      "amount": 150,
      "unit": "ml",
      "notes": {
        "es": "Aceite de oliva virgen extra",
        "en": "Extra virgin olive oil",
        "de": "Natives Olivenöl extra"
      }
    },
    {
      "id": "salt",
      "ingredientId": "salt",
      "name": {
        "es": "Sal",
        "en": "Salt",
        "de": "Salz"
      },
      "amount": 6,
      "unit": "g",
      "notes": {
        "es": "Sal",
        "en": "Salt",
        "de": "Salz"
      }
    }
  ],
  "instructions": [
    {
      "step": {
        "es": "Cortar las patatas",
        "en": "Slice the potatoes",
        "de": "Kartoffeln schneiden"
      },
      "text": {
        "es": "Pelar las patatas y cortarlas en láminas finas.",
        "en": "Peel the potatoes and cut them into thin slices.",
        "de": "Kartoffeln schälen und in dünne Scheiben schneiden."
      }
    },
    {
      "step": {
        "es": "Pochar las patatas",
        "en": "Slow-cook the potatoes",
        "de": "Kartoffeln langsam garen"
      },
      "text": {
        "es": "Cocinar las patatas en abundante aceite de oliva a fuego medio-bajo hasta que estén tiernas.",
        "en": "Cook the potatoes in plenty of olive oil over medium-low heat until tender.",
        "de": "Kartoffeln in reichlich Olivenöl bei niedriger bis mittlerer Hitze weich garen."
      }
    },
    {
      "step": {
        "es": "Mezclar con huevo",
        "en": "Mix with eggs",
        "de": "Mit Ei vermischen"
      },
      "text": {
        "es": "Batir los huevos con sal y mezclar con las patatas escurridas.",
        "en": "Beat eggs with salt and combine with the drained potatoes.",
        "de": "Eier mit Salz schlagen und mit den abgetropften Kartoffeln vermischen."
      }
    },
    {
      "step": {
        "es": "Reposar la mezcla",
        "en": "Rest the mixture",
        "de": "Mischung ruhen lassen"
      },
      "text": {
        "es": "Dejar reposar unos minutos para integrar sabores.",
        "en": "Rest for a few minutes to combine flavors.",
        "de": "Einige Minuten ruhen lassen, damit sich die Aromen verbinden."
      }
    },
    {
      "step": {
        "es": "Cuajar la tortilla",
        "en": "Cook the omelette",
        "de": "Tortilla braten"
      },
      "text": {
        "es": "Cocinar en sartén caliente hasta conseguir el punto deseado, girando la tortilla para dorar ambos lados.",
        "en": "Cook in a hot pan until reaching the desired doneness, turning once to brown both sides.",
        "de": "In einer heißen Pfanne bis zum gewünschten Gargrad braten und einmal wenden."
      }
    }
  ],
  "sources": [
    {
      "type": "traditional",
      "name": "Receta Tradicional de Tortilla Española",
      "description": {
        "es": "El estándar tradicional purista sin cebolla, perfeccionado en los hogares españoles.",
        "en": "The traditional purist standard without onion, refined in Spanish homes.",
        "de": "Der traditionelle puristische Standard ohne Zwiebeln, verfeinert in spanischen Haushalten."
      }
    }
  ],
  "author": {
    "type": "platform",
    "name": "tortilladepatatas.org"
  }
}